Title,Views,Likes,Comments,Date,Duration_ISO
99% Python Developers don't know this - AI will change Python Development!🔥,11730,394,49,2025-03-14T09:50:49Z,PT10M2S
FREE! FREE! FREE!!!,5372,340,10,2024-12-19T14:09:35Z,PT40S
What Sets Google Workspace Apart - Google Workspace Summit 2024,6990,236,4,2024-12-17T16:14:49Z,PT36S
The Best Network monitoring and device blocking app for PC and mobile | Trying the Fing Wifi app,10500,184,12,2024-10-20T05:30:01Z,PT14M24S
How to Scrape Amazon Using AI (with least manual coding) 🔥,3119,85,9,2024-10-09T12:30:00Z,PT10M
"Lets build a Markdown blog using Next.js, Shadcn UI, Rehype and Tailwind CSS 🔥",20795,696,52,2024-08-24T12:30:26Z,PT2H35M15S
Tech Talks with Google Kubernetes Lead & Director Customer Engineering | Chen and Subram,4103,174,20,2024-07-24T05:30:00Z,PT4M51S
AI Talks with Google Deepmind Director Dr. Manish Gupta 🔥,2523,133,12,2024-07-23T12:03:06Z,PT10M6S
How to make a Wordpress Travel Website using the WP Travel Engine 🔥,12657,219,17,2024-05-28T12:30:39Z,PT18M41S
Superwall: Quickly build & test paywalls without shipping updates,5533,92,6,2024-04-25T11:30:19Z,PT14M53S
Writing backend is no longer necessary - OneEntry Headless CMS🔥,6642,154,11,2024-03-29T09:00:48Z,PT36M20S
"Let’s Build a Tech Blog using HTML, Tailwind CSS, React, and Appwrite Cloud as a backend 🔥",4062,132,21,2024-02-04T15:30:01Z,PT38M7S
How to build a WordPress website with Elementor Hosting 🔥,2487,91,11,2023-12-02T14:30:05Z,PT19M36S
Elementor Hosting - The Best Hosting for Building with Elementor Pro 🔥,1531,77,8,2023-11-20T14:30:22Z,PT16M24S
Best WordPress Hosting for 2023 & Beyond 🔥,2015,113,26,2023-10-23T09:30:07Z,PT15M7S
"Project: Create a Blog Using Next.js, Tailwind CSS and Appwrite Cloud 🔥",10394,234,35,2023-06-16T11:30:17Z,PT39M34S
Creating a Full Stack Web Application using Only Python 🔥,24155,745,43,2023-05-07T09:32:36Z,PT27M33S
One Tip to learn Coding Fast!,229092,11135,75,2023-04-11T13:30:12Z,PT49S
Money Making Opportunity 🔥🤑,28724,2353,24,2023-04-10T11:30:12Z,PT32S
Which Programming Language to Learn?,335969,16862,110,2023-04-09T12:15:04Z,PT55S
Best way to learn React!,28753,1295,21,2023-04-08T10:49:49Z,PT26S
Requests Module in Python (Deepdive),6126,146,26,2023-04-07T17:39:44Z,PT33M33S
Best Todos App Ever!,6710,376,10,2023-04-01T07:15:48Z,PT33S
"Creating a Dictionary app Using HTML, CSS & JavaScript + RapidAPI  🔥",35158,845,46,2022-12-06T19:56:44Z,PT21M38S
My Favorite VS Code Extension 🔥,33047,2611,23,2022-12-06T06:43:17Z,PT47S
Operators & Expressions in JavaScript | Ultimate JavaScript Course #6,24634,582,77,2022-07-25T11:30:09Z,PT21M10S
JavaScript Chapter 1 - Practice Set | Ultimate JavaScript Course #5,6995,185,21,2022-07-24T16:30:10Z,PT12M24S
Primitives and Objects in JavaScript | Ultimate JavaScript Course #4,4791,168,24,2022-07-24T07:08:02Z,PT13M29S
"const, let and var in JavaScript | Ultimate JavaScript Course #3",4942,162,19,2022-07-23T16:30:00Z,PT10M28S
Variables in JavaScript | Ultimate JavaScript Course #2,9273,309,39,2022-07-17T11:57:11Z,PT12M24S
Introduction to JavaScript + Setup | Ultimate JavaScript Course #1,34031,1242,110,2022-07-15T16:30:02Z,PT11M17S
"Python Project: Extracting Amazon Reviews using Requests, BeautifulSoup & SOAX 🔥",14167,385,40,2022-07-09T14:30:08Z,PT31M9S
HarperDB - A Fast & Flexible Database on the Market,11186,706,14,2022-07-07T07:07:45Z,PT1M
Perform multidimensional analysis for free | Intro to atoti,6674,187,19,2022-06-03T05:30:30Z,PT18M31S
How to Create a Wordpress Website?,10270,386,50,2022-05-09T09:35:58Z,PT24M26S
HTML Tutorial For Beginners (With Notes) 🔥,112155,4042,321,2021-10-21T17:27:11Z,PT1H59M40S
C Language Tutorial for Beginners (With Notes) 🔥,1477878,35228,2248,2021-09-03T07:02:57Z,PT10H53M16S
Python Tutorial For Beginners (With Notes) 🔥,1203024,32645,1741,2021-07-26T18:05:15Z,PT11H38M28S
Deploying our Django Blog in Ubuntu 18.04 VPS | Django Tutorial #34,44303,1132,117,2020-07-09T12:38:36Z,PT35M49S
Adding Virtual Environment to our Django Blog | Django Tutorial #33,21254,555,36,2020-07-09T09:35:14Z,PT18M22S
Creating Contact Model + UI for our Django Blog | Django Tutorial #32,10689,282,40,2020-06-27T13:33:03Z,PT20M32S
Designing The Pagination Logic For Our Django Blog | Django Tutorial #31,7909,214,28,2020-06-26T04:30:04Z,PT38M52S
Making Design Improvements in Our Django Blog | Django Tutorial #30,7295,220,19,2020-06-25T15:30:00Z,PT9M12S
Customizing Tiny MCE For Better Editing Experience | Django Tutorial #29,5282,160,33,2020-06-25T07:37:21Z,PT18M25S
Finishing up Tiny MCE Rich Text Editor | Django Tutorial #28,5669,172,23,2020-06-25T02:30:07Z,PT13M5S
Adding Rich Text Editor to the Django Admin | Django Tutorial #27,10769,223,33,2020-06-24T13:11:43Z,PT17M50S
Django Blog: Designing The HomePage | Django Tutorial #26,14403,311,33,2020-06-19T10:00:31Z,PT22M40S
Django Blog: Rendering the Blog on Blog Page | Django Tutorial #25,5592,196,24,2020-06-19T03:15:01Z,PT14M57S
Django Blog: Designing the Blog Home Page | Django Tutorial #24,7050,196,19,2020-06-18T12:36:58Z,PT14M46S
Django Blog: Creating Blog Model For our Mountain Coders Blog | Django Tutorial #23,6570,213,26,2020-06-17T04:25:21Z,PT13M28S
Django CMS: Adding Bootstrap to our Django Blog | Django Tutorial #22,8196,198,27,2020-06-16T05:27:26Z,PT15M52S
Django CMS: Creating a Django Blog | Django Tutorial #21,18480,337,39,2020-06-08T11:24:30Z,PT15M51S
Django Authentication and Authorization Tutorial | Django Tutorial #20,12633,309,44,2020-06-02T10:28:02Z,PT15M39S
Project 2: Finishing Up ToDos List Django App | Django Tutorial #19,7227,242,20,2020-05-31T03:30:00Z,PT10M25S
Project 2: Fetching Data from our Models for ToDos List Django App | Django Tutorial #18,17906,430,38,2020-05-30T12:10:19Z,PT10M20S
Project 2: Using Django Template Language in our ToDos List Django App | Django Tutorial #17,8047,328,32,2020-05-29T15:35:26Z,PT14M3S
Project 2: Creating Models & Superuser for Our ToDos List Django App | Django Tutorial #16,12864,400,32,2020-05-28T16:29:49Z,PT22M18S
Project 2: ToDos List App in Django | Django Tutorial #15,30708,540,33,2020-05-27T11:50:03Z,PT18M30S
Template Inheritance in Django | Django Tutorial #14,13123,382,36,2020-05-26T05:30:02Z,PT15M24S
Using Static Files & StaticFiles Dirs in Django | Django Tutorial #13,30825,578,50,2020-05-26T02:30:00Z,PT17M58S
Customizing the Django Admin Interface | Django Tutorial #12,41416,827,52,2020-05-25T16:30:05Z,PT15M56S
Understanding the Django Admin Interface | Django Tutorial #11,17534,516,40,2020-05-25T13:40:23Z,PT14M16S
Models in Django: Saving Form Data To The Database | Django Tutorial #10,56515,1012,111,2020-05-24T05:55:25Z,PT25M6S
Adding Further Design to our Developer Portfolio Website | Django Tutorial #9,19229,451,32,2020-05-23T12:59:50Z,PT21M13S
Portfolio Website: Integrating Bootstrap with Django | Django Tutorial #8,25609,593,68,2020-05-23T09:00:27Z,PT22M13S
Using Templates & Django Template Engine in Django | Django Tutorial #7,26885,937,89,2020-05-23T05:30:05Z,PT15M20S
Creating a Developer Portfolio Website Using Django | Django Tutorial #6,49495,1066,37,2020-05-23T02:30:01Z,PT16M58S
MVT Pattern in Django | Django Tutorial #5,27932,998,72,2020-05-22T18:42:20Z,PT20M12S
"Apps, Projects and UrlPatterns in Django | Django Tutorial #4",31873,950,71,2020-05-21T20:54:14Z,PT25M4S
Folder Structure of a Django Application | Django Tutorial #3,45805,1100,44,2020-05-21T11:30:05Z,PT13M33S
"How Django Works with HTML, CSS & JavaScript | Django Tutorial #2",54098,1203,62,2020-05-21T07:50:46Z,PT18M50S
"Installing VS Code, Django & More | Django Tutorial #1",189207,4837,292,2020-05-20T14:30:28Z,PT16M56S
Object Oriented Programming - Classes & Objects in Python | Python Tutorial #34,8036,240,36,2020-02-28T19:15:28Z,PT9M54S
HTML for Web Development Tutorial for Beginners (2020 Updated Course),42449,1046,110,2019-12-04T09:58:41Z,PT44M39S
Project 1: Jarvis - Python AI Virtual Desktop Assistant | Python Tutorial #33,230024,5878,1328,2019-10-19T17:31:04Z,PT55M9S
Lambda Functions In Python | Python Tutorial #32,3773,112,7,2019-09-30T02:30:02Z,PT7M5S
"Iterators, Iterables & Generators In Python | Python Tutorial #31",6839,191,16,2019-09-29T05:21:06Z,PT16M7S
List Comprehensions In Python | Python Tutorial #30,4591,131,18,2019-09-28T07:58:52Z,PT8M34S
Number Guessing Game: Python Exercise 3 Solution | Python Tutorial #29,31836,482,30,2019-09-16T05:19:32Z,PT6M29S
Guess the number: Python Exercise 3 | Python Tutorial #28,3032,78,35,2019-09-09T11:30:03Z,PT3M38S
"f.read(), f.readline() & f.readlines() in Python | Python Tutorial #27",21280,363,18,2019-09-08T08:58:56Z,PT6M20S
File Handling in Python | Python Tutorial #26,15432,352,19,2019-08-31T13:30:00Z,PT14M12S
Escape sequence characters in Python | Python Tutorial #25,24446,570,21,2019-08-30T15:25:14Z,PT5M17S
Short Hand If - Else Notation in Python | Python Tutorial #24,4809,118,6,2019-08-29T03:29:35Z,PT5M32S
Exercise 2: Solution + Shoutouts | Python Tutorial #23,13152,109,7,2019-08-28T05:22:44Z,PT10M51S
Try except and Error handling in Python | Python Tutorial #22,3710,128,8,2019-08-27T02:30:01Z,PT13M53S
For else in Python | Python Tutorial #21,4060,156,10,2019-08-26T04:10:45Z,PT7M39S
Modules & pip in Python | Python Tutorial #20,9065,223,19,2019-08-25T12:30:01Z,PT12M51S
Recursions in Python | Python Tutorial #19,3853,150,18,2019-08-25T06:48:37Z,PT11M59S
Exercise 2: Twinkle Twinkle Little Star | Python Tutorial #18,7496,136,28,2019-08-24T14:30:02Z,PT4M43S
Functions in Python | Python Tutorial #17,7900,192,23,2019-08-24T10:19:16Z,PT12M14S
Exercise 1: Solution + Shoutouts | Python Tutorial #16,19141,165,18,2019-08-24T06:41:06Z,PT6M23S
While Loops in python | Python Tutorial #15,5668,173,17,2019-08-20T09:50:43Z,PT7M2S
For Loops in python | Python Tutorial #14,5174,192,28,2019-08-20T08:34:35Z,PT11M4S
If else conditionals in Python | Python Tutorial #13,5147,157,33,2019-08-20T06:27:48Z,PT14M7S
Sets in Python | Python Tutorial #12,4615,158,26,2019-08-18T16:50:39Z,PT9M13S
Dictionary and related methods in Python | Python Tutorial #11,6035,207,22,2019-08-18T13:25:21Z,PT12M35S
Tuple in Python | Python Tutorial #10,36574,900,36,2019-08-18T13:10:55Z,PT9M16S
Lists in Python | Python Tutorial #9,6611,197,16,2019-08-18T10:06:22Z,PT14M28S
Taking user input in Python  | Python Tutorial #8,31153,586,32,2019-08-18T08:50:11Z,PT11M54S
F-strings in Python | Python Tutorial #7,12485,357,48,2019-08-18T06:31:01Z,PT9M32S
Exercise 1: Capitalize my name & String concatenation | Python Tutorial #6,8732,225,102,2019-08-18T05:52:59Z,PT6M14S
Python strings and built in string methods | Python Tutorial #5,15300,515,29,2019-08-17T13:02:28Z,PT15M13S
Operators in Python | Python Tutorial #4,10873,397,19,2019-08-17T09:19:07Z,PT13M7S
Numbers & Typecasting in python | Python Tutorial #3,20146,594,31,2019-08-17T08:51:54Z,PT11M11S
Variables & Comments in Python | Python Tutorial #2,30292,930,61,2019-08-17T07:18:14Z,PT15M7S
"Installing VS Code, Python & writing hello world Python code | Python Tutorial #1",488772,10857,753,2019-08-16T11:17:13Z,PT17M11S
Django queryset tutorial: Making Queries in Django,82373,745,51,2019-08-15T14:19:53Z,PT27M30S
Django 2.2 Tutorial For Beginners,55452,1021,90,2019-06-15T18:05:01Z,PT59M48S
[Solved] No python interpreter configured for the project pycharm,508301,8265,767,2019-06-15T08:20:50Z,PT6M36S
[Solved] Invalid python interpreter selected for the project pycharm,70508,1528,153,2019-06-14T14:32:36Z,PT5M42S
"[SOLVED] pip is not recognized as an internal or external command, operable program or batch file",242714,4182,488,2019-06-13T18:06:01Z,PT9M8S
Python Tutorial For Beginners (Complete Course),355451,10122,1605,2019-06-12T18:43:11Z,PT1H31M9S
